{
  "version": 1,
  "name": "clinx",
  "context": [
    {
      "path": "docs/en/method.md",
      "description": "Method and semantic adequacy",
      "when": ["discover", "contract", "learn"]
    },
    {
      "path": "docs/en/architecture.md",
      "description": "Canonical artifacts, runtime ownership and limits",
      "when": ["discover", "contract", "build", "verify"]
    },
    {
      "path": "CONTRIBUTING.md",
      "description": "Local engineering and release authority",
      "when": ["always"]
    }
  ],
  "sources": [
    {
      "id": "project",
      "path": ".",
      "inputs": ["."],
      "exclude": [
        ".git",
        ".DS_Store",
        ".clinx",
        "node_modules",
        "dist",
        "artifacts",
        "clinx/tasks",
        "coverage",
        "examples/maven-reactor/policy/target",
        "examples/maven-reactor/application/target",
        "examples/node-picker/.clinx",
        "examples/reading-list/.clinx",
        "examples/maven-reactor/.clinx",
        "examples/multi-source/workspace/.clinx"
      ]
    }
  ],
  "checks": [
    {
      "id": "types",
      "source": "project",
      "description": "Strict TypeScript model and implementation checks",
      "command": ["npm", "run", "typecheck"],
      "result": { "format": "exit-code" }
    },
    {
      "id": "regressions",
      "source": "project",
      "description": "Build from the bound source, then run named semantic and CLI regressions",
      "command": ["node", "scripts/junit-tests.mjs"],
      "result": {
        "format": "junit",
        "from": "stdout",
        "minTests": 194,
        "expectedTests": [
          "test#release bundles preserve exact packaged Skill bytes and never overwrite a candidate",
          "test#every command has focused human and machine help without touching the workspace",
          "test#Skill upgrades preserve the installed baseline of a simulated prior package",
          "test#release bundling refuses packaged local state before producing a shareable bundle",
          "test#example copy excludes nested local state and retains executable wrapper behavior",
          "test#write failures roll back completed changes without discarding original backups",
          "test#real Node domain + HTTP example and negative control",
          "test#revision preserves old contract and invalidates prior handoff",
          "test#a modified pass flag cannot override malformed saved test output",
          "test#inspect empty project without initialization or mutation",
          "test#client keeps the newest refresh and does not drop a post-write refresh",
          "test#verification failure exposes the check, actual failure and readable log locations",
          "test#real full-stack example verifies HTTP and persistence, not browser approval",
          "test#attachments preserve artifacts and never satisfy an external obligation",
          "test#cold-start fixture runs existing HTTP tests but fails the new product oracle",
          "test#execution preserves symlink invocation identity and child-relative PATH",
          "test#a change to an explicitly declared build directory invalidates old evidence",
          "test#context and checkpoints refresh retained configuration instead of restoring an old index",
          "test#Skill onboarding preserves existing configuration and does not scan generated environments",
          "test#bounded reads allocate by file size and preserve exact-limit and empty-file behavior",
          "test#evaluation arms receive identical raw projects without clinx task guidance",
          "test#bulk boundary oracle accepts a compatible implementation through the actual receiver",
          "test#bulk boundary oracle rejects encoding, capacity, retry and false-success regressions",
          "test#CLI keeps passing baseline evidence separate from unresolved delivery semantics",
          "test#collaboration declarations and a manual pass do not approve an external claim",
          "test#changed confirmation context invalidates local bindings without interpreting approval",
          "test#bounded reads reject a FIFO without waiting for a writer",
          "test#suite-level errors cannot produce a supported CLI claim",
          "test#source entry limits count empty directories as well as files",
          "test#native test output works without JUnit and preserves real assertion failures",
          "test#completed exit 0 survives stdout storage failure without a supported claim",
          "test#interrupted execution and surviving artifacts are retained when archiving fails",
          "test#unexpected execution errors are unknown, never a claim that nothing ran",
          "test#unavailable source roots preserve history while current execution remains blocked",
          "test#receipt definition is self-contained and selector drift does not corrupt historical interpretation",
          "test#corrupt saved source definitions cannot interpret historical pass or support current claims",
          "test#retired checks leave historical observations and handoffs readable but forbid new execution",
          "test#source-owned evidence copies original bytes with qualified identity and survives original removal",
          "test#stored artifact origins must remain unique and inside captured source identity",
          "test#source-only, translation-only and simultaneous edits all require explicit pair review",
          "test#language directories pair nested guides and reject orphan or flat guides",
          "test#hands-on guide JSON runs the documented task without treating passing old tests as product acceptance",
          "test#receipt paths accept the selected workspace alias without accepting inner symlinks or escapes",
          "test#context navigation selects task sources and focus while retaining workspace references",
          "test#workspace navigation binds acceptance only when explicitly referenced as a task input",
          "test#co-located task design is an input while unbound validation notes are outputs",
          "test#workspace Skill onboarding neither requires source guides nor changes source files",
          "test#canonical keys and source paths use locale-independent ordering without Unicode ties",
          "test#JSON diagnostics identify the file without echoing its potentially private contents",
          "test#execution preserves stream order and independently bounds stdout and stderr",
          "test#inspect isolates unusable check directories without discarding valid navigation or executing"
        ]
      }
    },
    {
      "id": "hygiene",
      "source": "project",
      "description": "Markdown links, translation review bindings, model/schema sync, Skill metadata and basic leak heuristics",
      "command": ["node", "scripts/check-project.mjs"],
      "result": { "format": "exit-code" }
    }
  ]
}
